question_id,question_text,option_a,option_b,option_c,option_d,option_e,correct_answer_id
320,PR-ı formalaşdıran hüquqi normativ qanunlar və aktların mənbə göstəricisi nədir,İnformasiya haqqında qanun,AR Konstitusiyası,AR Televiziya və radio haqqında qanun,heç biri,PR haqqında qanun,b
321,PR fəaliyyəti reklamdan hansı xüsusiyyəti ilə fərqlənir?,Yalnız gəlir gətirmək məqsədi ilə istifadə edilir,Təşkilatın nüfuzunu qorumaq üçün uzunmüddətli strategiyalar qurur,PR məhsulun texniki xüsusiyyətlərini təqdim edir,Reklam PR strategiyalarını tamamlayır,PR yalnız medianın dəstəyi ilə həyata keçirilir,b
322,Reklamın əsas xüsusiyyətinə aiddir,İctimai rəyə təsir etmək,Alıcı ilə satıcı arasında əlaqə yaratmaq,Böhran idarəetməsini təşkil etmək,Hədəf kütləsinin analizini aparmaq,Uzunmüddətli etibarlı əlaqələr qurmaq,b
323,PR fəaliyyətində əsas məqsəd nədir?,Yalnız təşkilat daxilində əməkdaşlıq etmək,Cəmiyyətlə qarşılıqlı anlaşma yaratmaq,Yalnız reklam strategiyaları ilə məşğul olmaq,Müştəri bazasını genişləndirmək,İctimaiyyətin diqqətini mənfi cəhətlərdən yayındırmaq,b
324,PR və reklam arasında əsas fərqi nədir?,Reklam təşkilatların nüfuzunu möhkəmləndirir,PR hər zaman ödənişlidir,Reklam ictimai rəy yaratmaq məqsədi güdür,"PR müsbət obraz yaradır, reklam isə satış məqsədi güdür",PR hədəf auditoriyasını genişləndirir,d
325,İctimaiyyətlə əlaqələrdə vacib üslub elementi nədir?,Yalnız daxili müzakirələr üçün nəzərdə tutulması,Məlumatın açıq və aydın olması,Məhsul reklamlarının üstünlük təşkil etməsi,Təşkilatın zəif tərəflərini gizlətməsi,Təşkilat məlumatlarının məhdudlaşdırılması,b
326,Natiq sözünü hansı ifadə ilə əvəz etmək olar?,Ritor,Fikirləşən,Məlumat verən,Çıxış edən,Danışan,c
327,"Böyük sivilizasiya, qabaqcıl dövlət idarəçiliyinə malik olan, monolit ölkə hansıdır?",Misir,Yaponiya,Hindistan,Yunanıstan,Çin,e
328,"İKT və digər beynəlxalq təşkilatların toplantılarında birmənalı mövqe tutmuş, Azərbaycanın haqq işini müdafiə etmiş ərəb dövləti hansıdır?",Yəmən,BƏƏ,SƏ,Qatar,Küveyt,b
329,Klassik reklam nədir?,Danışıqların aparılması yolu ilə yeni məhsulun üstünlüklərinə dair ətraflı məlumamatlar verilir,"Bu radio, televiziyanın, eləcə də qəzet və jurnalların köməyi ilə müraciət halında verilir","Bu radio, televiziyanın, eləcə də qəzet və jurnalların köməyi ilə müraciət halında verilir",Reklamın bu növünü əsasən nüfuzlu şəxslər öz ardıcılları arasında həyata keçirir,Bu ikitərəfli kommunikasiyadır,b
330,Reklam Haqqında Qanun nə vaxt qəbul edilib?,2014,2015,2012,2011,2013,b
331,Cavablardan hansı Reklamı izah edir,İstənilən ölkədə cəlb etmək məqsədi ilə yayımlanan məlumatdır,Yazılı formada cəlb etmək məqsədi ilə yayımlanan məlumatdır,Şəkil formada cəlb etmək məqsədi ilə yayımlanan məlumatdır,Hər küçədə cəlb etmək məqsədi ilə yayımlanan məlumatdır,İstənilən formada əmtəəni bazarda tanıtmaq məqsədi ilə yayımlanan məlumatdır,e
332,Aşağıdakılardan hansı reklamın subyekti hesab edilir?,Binalar,Fiziki şəxslər,Divarlar,Vətəndaşlar,Reklam istehlakçısı,e
333,Yarmarkaların təşkilinin qarşısında qoyulan məqsədlərə daxildir..,Məhsulun imicinin yüksəldilməs,Müəssisələrə etibarlı tərəf müqabil obrazını formalaşdırmaq,Məhsul satışının stabilləşdirilməsi,Cəmiyyətdə müəssisə hsqqında xoş fikir formalaşdırmaq,Regionlararası mal mübadiləsi əməliyyatlarının genişləndirilməsi,e
334,Yarmarkaların təşkilinin qarşısında qoyulan məqsədlərə aiddir..,Məhsul satışının stabilləşdirilməsi,Yeni məhsulun satışının artırılması,Satışın həcminin planlaşdırılması,Məhsulun imicinin yüksəldilməsi,Tərəflər arasında işküzar və səmərəli əlaqələrin yaradılması,e
335,Yarmarkaların təşkilinin qarşısında qoyulan məqsədlərə aiddir,Brokerlərin işinin təşkil edilməsi,Vasitəçilərin məhsulla tanış edilməsi,Müəssisələrın etibarlı tərəf müqabil obrazının formalaşdırılması,Məhsul satışı üzrə müqavilələrin bağlanması,Yüksək keyfiyyətli məhsul buraxılışının artırılması,d
336,Yarmarkaların təşkilinin qarşısında qoyulan məqsədlərə aid deyildir,Vasitəçilik və kommersiya xarakterli xidmətlər göstərilməsi,Məhsulların seriyalı istehsalı haqqında qərar qəbul edilməsi,Məhsul çeşidinin genişləndirilməsi,Məhsul satışı üzrə bölgü kanallarının yaradılması,Məhsul istehsalı planının formalaşdırılması,d
337,Bu yarmarkaların təşkili formalarının sayıdır:,5,6,3,4,2,e
338,Yarmarkaların təşkili formalarına daxildir:,Mövsümi yarmarkalar,Sosial xarakterə malik yarmarkalar,İstehlak malları üzrə yarmarkalar,Daimi yarmarkalar,Dəyişkən yarmarkalar,d
339,Yarmarka ticarətinin predmetidir:,İstehsal –texniki təyinatlı məhsullar,Ərzaq məhsulları,Həyat dövranının böhram mərhələsində olan mallar,"Əvvəlcədən sifariş olunan, satış imkanlarından daha çox istehsal edilən mallar",Seriyalı istehsalı nəzərdə tutulan mallar,d
340,Yarmarkaların əsas xüsusiyyəti bundan ibarətdir:,"Yarmarkalarda istehsalçilar, vasitəçilər və istehlakçilar iştirak edirlər",Yarmarkalar əsasən istehlak malları üzrə təşkil olunurlar,Yarmarkaların təşkili yeni yaradılmış məhsulların seriyalı istehsal haqqında qərar qəbul etməyə imkan verir,Yarmarkalarda satışda mallar mövcud olmur,Yarmarkalar mövcümi xarakter daşıyır,d
341,Yarmarkaların əsas xüsusiyyəti nədən ibarətdir:,Məhsul çeşidinin genişləndirilməsi həyata keçirilir,Vasitəçilik və kommersiya xarakterli xidmətlər göstərilir,Məhsul satışı üzrə bölgü kanallarının yaradılması,Yarmarkalarda məhsulların fərdi satışı həyata keçirilmir,Müəssisələrın etibarlı tərəf müqabil obrazı formalaşdırılır,d
342,Yarmarkalarda aşağıdakılardan birindən istifadə olunmur.,Kataloqlar,Slaydlar,Plakatlar,Elektron poçt xidməti,Fotoşəkillər,d
343,Yarmarkalarda bundan istifadə olunmur,Kino-video roliklər,Məhsul nümunələri,Broker xidməti,Bukletlər,Maketlər şəklində yeniliklər,c
344,Yarmarkaların iş prinsipi bundan ibarətdir,Yarmarkalar xüsusi daimi mövcud olan yerlərdə və yaxud icarəyə götürülmüş sahələrdə təşkil olunurlar.,Yarmarkada istehsalçılar və alıcılar arasında danışıqlar aparılır.,"Yarmarkalar məhsul istehlakçıları, vasitəçilər və alıcılar arasında qarşılıqlı əlaqələrin möhkəmləndirilməsinə xidmət göstərir",Yarmarkada öz məhsullarının reklamını və ya satışın həyata keçirmək istəyən şəxs əvvəlcədən özünə lazım olan qədər sahə sifariş etməli və onun dəyərini ödəməlidir,Yarmarkalarda məhsul nümunələri əsasında satış müqavilələri bağlanılır,d
345,Sosial reklam dövlət yayımçılar tərəfindən ...?,Yayımlanır,Ödənişsiz yayımlanır,Ödənişli yayımlanır,Ödənişli və ödənişsiz formada yayımlanır,Yayımlanmır,b
346,Reklam haqqında Qanun nə zamann qəbul edilmişdir?,2014,2015,2013,2011,2012,b
347,"Reklam haqqında Qanun reklamın sifarişi, istehsalına və yayımlanması sahəsində münasibətlərin, onlara nəzarətin və tənzimləmənin, həmçinin reklam sahəsində özünütənzimləmənin _________",Siyasi əsaslarını müəyyən edir,Hüquqi əsaslarını müəyyən edir,İqtisadi əsaslarını müəyyən edir,Mədəni əsaslarını müəyyən edir,Sosial əsaslarını müəyyən edir,b
348,Reklam haqqında Qanun reklamın sifarişi sahəsində münasibətlərin ...?,Mədəni əsaslarını müəyyən edir,Hüquqi əsaslarını müəyyən edir,İqtisadi əsaslarını müəyyən edir,Sosial əsaslarını müəyyən edir,Siyasi əsaslarını müəyyən edir,b
349,Versal sülh sisteminin dünyada yaratdığı ən böyük ziddiyyət hansıdır?,İqtisadi böhran,İdeoloji və sinfi qarşıdurma,Hərbi sənaye sahəsinin öz qüdrətini itirməsi,İqtisadi əlaqələrin zəifləməsi,Milli münaqişələr,b
350,Ağ PR nə vaxt istifadə olunur?,Yalnız yeni zamanda,Heç biri,Böhran vəziyyətlərində,Qeyri-rəsmi məlumat yaymaq üçün,Təşkilatın müsbət obrazını genişləndirmək üçün,e
351,PR növlərinin məqsədi nədir?,İnsanları çaşdırmaq,Şirkət və ya məhsul haqqında məlumat yaymaq,Rəqibləri gözdən salmaq,İşçiləri fəaliyyətlərdən uzaqlaşdırmaq,Mətbuatdan uzaq qalmaq,b
352,PR-in hansı növü ödənişsizdir?,Virus PR-ı,Pablisiti,Sarı PR,Yaşıl PR,Qara PR,b
353,Çəhrayı PR nə üçün istifadə olunur?,Qeyri-müsbət xəbərləri gizlətmək,İctimaiyyət arasında pozitiv emosiyalar yaratmaq,Yalnız media ilə əlaqə qurmaq,Rəqiblərə üstünlük vermək,Təbii resurslardan istifadəni məhdudlaşdırmaq,b
354,Yaşıl PR hansı sahədə tətbiq edilir?,Rəqabəti gücləndirmək üçün,Ətraf mühitin qorunması ilə bağlı kampaniyalarda,Gizli məlumat yayma üçün,Texniki avadanlıq təqdimatı zamanı,Şirkət imicini artırmaq üçün,b
355,Sarı PR nəyi əhatə edir?,Etibarlı xəbərləri yaymağı,Mətbuat vasitəsilə qadağan olunmuş elementləri yaymağı,Sosial şəbəkələrdə müsbət rəylər yazmağı,Rəqibləri dəstəkləməyi,Şirkət fəaliyyətini təşviq etməyi,b
356,Boz PR-ın xüsusiyyəti nədir?,Şirkət daxili tədbirləri əhatə edir,Şəffaf və doğruluqla həyata keçirilir,Yalnız müsbət imic yaratmaq məqsədi daşıyır,Naməlum mənbələrdən yayılan informasiya,Ətraf mühitə diqqət ayırır,d
357,Virus PR-ı necə xarakterizə edilir?,Təşkilatın planlı strategiyasıdır,Şaiyə və qeybətlərin yayılması ilə PR əldə etmək,Ekoloji layihələr üzərində iş,Təhsil layihələrinin təşviqi,Media vasitəsilə ödənişli reklam,b
358,Qara PR nədir?,Müsbət imic formalaşdıran PR növüdür,Heç biri,Rəhbərliyi dəstəkləyən PR fəaliyyətidir,Yalan məlumatların yayılmasıdır,Təhsil layihələrinə əsaslanan PR növüdür,d
359,BMT-nin nizamnaməsi təşkilatın yaranmasının 4 əsas məqsədini müəyyən edir. Hansı varint yanlışdır?,"İrqindən, cinsindən, dilindən, dinindən asılı olmayaraq insan hüquqları və əsas azadlıqlarınına hörmətlə yanaşaraq beynəlxalq emekdaşlığı təmin etmək",Millətlər və dövlətlər arasında dostluq yaratmaq,İctimai əlaqələri daha da gücləndimək,Dövlətlərin fəaliyyətinin və ümumi maraqlarının razılaşdırılmasını təmin etmək,Beynəlxalq sülhün və təhlükəsizliyi təmin etmək,c
360,Yarmarkaların birja ticarətindən fərqi hansıdır,"Yarmarkalarda maklerlər, brokerlər iştirak etmirlər",Yarmarkalarda istehsalçilarla istehlakçılar arasında qarşılıqlı əlaqələr yaradılır,Yarmarkalarda məhsul satışı həyata keçirilir,Yarmarkada məhsula tələbat formalaşdırılır,Yarmarkalarda müqavilələr bağlanılmır,a
361,Yarmarkaların birja ticarətindən fərqi nədir,Yarmarkalarda iştirak etmək üçün sifarişlər verilmir,Yarmarkalarda məhsulun reklamı həyata keçirilir,Yarmarkalarda qiymətin kotirovkası olunur,Yarmarkalarda bazarın öyrənilməsi həyata keçirilmir,Yarmarkalar daimi olaraq həyata keçirilir,c
362,Yarmarkaların birja ticarətindən fərqi bundan ibarətdir.,Yarmarkaların cari fəaliyyətinə direktorluq rəhbərlik edir,Yarmarkada iştirak edən şəxslər buna görə haqq ödəyirlər,Yarmarkalarda istehlakçiların tələbi öyrənilmir,Yarmarkalarda qiymətlər stabil olur,Yarmarkalarda marketinq xidməti fəaliyyət göstərir,d
363,Yarmarkaların yerinə yetirdiyi vəzifələrə aid deyildir,istehlakçılarla alıcılar arasında əlaqələr yaratmaq,potensial alıcıları aşkar etmək,məhsulların reklamını həyata keçirtmək,məhsulların bölgü kanallarını yaratmaq,malların satışını genişləndirmək,d
364,Yarmarkalar bunu həyata keçirmir,şəxsi satışı,imic stimullaşdırmasını,mala təlabat formalaşdırılmasını,satışın həcminin artırılmasını,əmtəənin irəlilədilməsini,a
365,Yarmarka təşkil olunmazdan əvvəl bu iş yerinə yetirilmir,bazar konyukturasının öyrənilməsi,nümayiş etdiriləcək malların müəyyənləşdirilməsi,məhsulların reklamının həyata keçirilməsi,alıcı tələbinin oyrənilməsi,təklifin vəziyyətinin oyrənilməsi,c
366,Bazarda artıq mövcud olan malların satışı üzrə yarmarkaların vəzifələrindındir,məhsul çeşidini genişləndirmək,ticarət vasitəçiləri ilə əlaqələri genişləndirmək,bazar tədqiqatlarını həyata keçirtmək,əlavə satış şəbəkəsi yaratmaq,malların satışını genişləndirmək,e
367,Bazarda artıq mövcud olan malların satışı üzrə yarmarkaların vəzifələrinə daxildir,satışın həvəsləndirilməsi üzrə tədbirlərin həyata keçirilməsi,satıcılarla alıcılar arsında qarşılıqlı əlaqələr yaradılması,məhsul satışının yaxşılaşdırılması üzrə təkliflərin və tövsiyələrin hazırlanması.,istehlakçıların tələbinin proqnozlaşdırılması,mallara əlavə təlabat yaradılması,e
368,Müasir dövrdə yarmarkaların inkişafına mane olan amillərə aiddir.,İnformasiya-kommunikasiya texnologiyalarından istifadə imkanlarının genişlənməsi.,Məhsul çeşidinin daima təzələnməsi,Məhsulların keyfiyyətində baş verən dəyişikliklər,Bölgü və satış kanallarının daima təkmilləşdirilməsi,Əmtəə bazarlarında mal qıtlığının mövcud olması,e
369,Müasir dövrdə yarmarkaların inkişafına mane olan amillərə aiddir:,Əmtəə bazarlarında rəqabətin güclənməsi,Müəssisələrin digər kommunikasiya elementlərinə daha çox üstünlük verməsi,İnteraktiv marketinqin tətbiqi,Əmtəə bazarlarında inhisarçılığın mövcudluğu,Elektron biznesin yaranması,d
370,Yeni məhsulların satışı üzrə yarmarkaların vəzifələrinə daxil deyildir:,Məhsulun keyfiyyətinin yüksəldilməsinin təmin edilməsi,Yeni məhsulun istehsalının oprimal həcminin müəyyənləşdirilməsi,Yeni məhsulun daha geniş miqyasda bazara çixarılmasının təmin edilməsi,Yeni məhsulun istehsalının və bazara çıxarılmasının optimal vaxtının müəyyənləşdirilməsi,Malların xarici görünüşünün bazarın tələblərinə uyğunlaşdırılması,a
371,Potensial sərmayəçi informasiyanı aldığı İxtisaslaşdırdmış nəşrlərə aid deyildir?,Kvartal üzrə maliyyə hesabatları,Rəhbərliyin mətbuat üçün açıqlamaları,Digər rəsmi informasiyalar,Qatarların və təyyarələrin hərəkət cədvə,İllik hesabatlar,d
372,Potensial sərmayəçidən ötrü sərmayə memorandumunun işlənilib hazırlanması əhatə edir:?,Şirkətin strategiyası,Bütün variantlar uyğundur,Sahənin bütövlükdə təsviri,Qarşıya qoyulan məqsədlərə çatmaq üçün atılan taktiki addımlar,Şirkətin idarə olunması barədə məlumat,b
373,Yeni dünya nizamının ən mübahisəli məsələsi nədən ibarətdir?,İctimai Əlaqələr və dövlətlərarası münasibətlərin kim tərəfindən - Rusiya yoxsa ABŞ tərəfindən nizamlanması məsələsi,"İctimai Əlaqələr və dövlətlərarası münasibətlərin kim tərəfindən - beynəlxalq təşkilatlar, yoxsa ABŞ tərəfindən nizamlanması məsələsi","İctimai Əlaqələr sisteminin əsası kimi,getdikcə beynəlxalq birliklər,təşkilatlar tərəfindən sosial siyasi təmayüllərin liberallaşdırılması məsələsi","İctimai Əlaqələr sistemində qərb dəyərlərinin bütün dünyaya yayılması ,millətlər və mədəniyyətlər arasında milli sədlərin silinməsi,dünyanın vahidləşməsi məsələsi",İctimai Əlaqələr sistemində insanlığın qlobal ümumiliyinin dərk olunması məsələsi,b
374,Mondializm nə demekdir?,Cemiyyetin vahidləşməsi prosesi,Milli dövlətlərin vahidləşməsi,Xalqların vahidləşməsi,Dünyanın vahidləşməsi prosesi,Müttəfiqlərin vahidləşməsi prosesi,d
375,Qloballaşma və yeni dünya nizaminin həyata keçirilməsində tətbiq olunan mühüm metodlardan biri ...?,İqtisadi əlaqələrin inkişafi,Beynəlxalq konsepsiya,Ətraf mühitin mühafizəsi,Dayanıqlı inkişaf,Münaqişələrin məqsədyönlü həlli,d
376,Tədqiqatçılar dünyanın geoiqtisadi xəritəsində qloballaşmanın hərəkətini neçə iqtisadi məkan çərçivəsində qruplaşdırırlar?,4,3,6,7,5,b
377,Cənubun böyük yeddilərinə aid olmayan ölkəsi hansıdır?,Çin,Cənubi Koreya,Meksika,Şimali Koreya,Hindistan,d
378,Regional inteqrasya prosesi dünyada ilk dəfə harada başlamışdır.?,Yaponiya,Orta Avropa,Qərbi Avropada,Amerikada,Şimali Avropa,c
379,İnteqrasiyanın ən mənfi cəhəti nədən ibarətdir?,Heç biri doğru deyil,Prosesə daxil olan subyektlərin milli maraqlarının pozulması,Prosesə daxil olan subyektlərin dini ideoloji dəyərlərinin pozulması,Prosesə daxil olan subyektlərin mədəni və mənəvi dəyərlərinin pozulması,Hamısı doğrudur,d
380,Demokratikləşmənin üçüncü dalğası''əsərinin müəllifi kimdir?,R.Koxen,S.Hantinqon,A.Melvil,M.Veber,V.Vilson,b
381,"A.Melvilin fikrinə görə, hansı səhvdir?",Azad evin təsnifatında ölkələri qeyri demokratik,Azad ev''in təsnifatında ölkələri demokratik və ''azad'',Azad evin təsnifatında ölkələri yarımdemokratik,Azad evin təsnifatında ölkələri nisbətən azad,Azad ev''-in təsnifatında ölkələri demokratik və asılı,e
382,Aşağıdakılardan hansı beynəlxalq təşkilatların təsnifatının prinsiplərinin sırasına daxil deyil?,Coğrafi prinsiplər,Üzvlük prinsipləri,Funksional prinsiplər,Qeyri-funksional prinsiplər,Formalaşma prinsipləri,e
383,Funksional baxımdan beynəlxalq təşkilatlar neçə yerə ayrılır?,5,6,3,4,2,e
384,Yarmarkaların təşkilinin və həyata keçirilməsinin əsas məqsədidir.,Yarmarkaya çıxarılan məhsulların şəxsi satışını həyata keçirmək,Yarmarkaya çıxarılan malların satışını həvəsləndirmək,Yarmarkaya çıxarılan məhsulların reklamını həyata keçirmək,Yarmarkaya çıxarılan məhsulları və onların istehsalçılarını alıcılara daha yaxından tanıtmaq,Yarmarkaya çıxarılan mıhsullara tələbat formalaşdırmaq və onların satışını genişləndirmək,d
385,Sərgilərin təşkilinin əsas məqsədidir:,Sərgiyə çıxarılan məhsulların şəxsi satışını həyata keçirmək,Sərgiyə çıxarılan məhsullara tələbat formalaşdırmaq,Sərgiyə çıxarılan məhsullara istehlakçıların tələbatını öyrənmək,"İstehsalçılar ticarət vasitəciləri və istehlakçılar arasında əlaqələr yaradılması, onlara zəruri məlumatların ötürülməsi.",Sərgiyə çıxarılan məhsulların birbaşa marketinqini həyata keçirmək,d
386,Sərgilər təşkil olunma dövrülüyünə görə bu qruplara bölünürlər,5,1,3,2,4,d
387,Sərgilərin təşkil olunma dövrülüyünə görə qruplarına aiddir,İmpulsivtəşkil olunansərgilər,Ardıcıl təşkil olunan sərgilər,Sıçrayış xarakterli sərgilər,Mövsumi sərgilər,Vaxtaşırı təşkil olunan sərgilər,e
388,Vaxtaşırı təşkil olunan sərgilərin məqsədlərinə aid deyildir.,Potensial alıcıların real alıcılara çevirməsini təmin etmək,Alıcılara məhsul haqqında zəruri informasiya ötürmək,Məhsulların şəxsi satışını həyata keçirmək.,Məhsullara tələbat formalaşdırmaq,Məhsulların reklamını həyata keçirmək,c
389,Daimi fəaliyyət göstərən sərgilərin məqsədlərinə daxil deyildir,Reklam fəaliyyətinin həyata keçirilməsi,Məhsulların birbaşa marketinq qaydasında satışının həyata keçirilməsi,Müqavilə əsasında elmi-texniki nailiyyətlərin yeni texnologiyaların reklamlarının həyata keçirilməsi,Məhsulların nümayış etdirilməsi,İstehsalçı müəssisələrə və fərdi sahibkarlara informasiya təminatı üzrə xidmət göstərilməsi.,b
390,Daimi fəaliyyət göstərən sərgilərin məqsədlərinə aid deyildir,Mütərəqqi texnika və texnologiyaların tətbiqi üzrə məlumatların məqsədli auditoriyalara çatdırılması,potensial alıcıların yeni məhsul haqqında məlumatlandırılması,Digər regionların müəssisə və təşkilatları ilə informasiya əlaqələrinin yaradılması,sərgiyə çıxarılan məhsulların şəxsi satışının həyata keçirilməsi,sərgilərdə müəssisə və təşkilatlarla birlikdə sərgi –məlumat sisteminin yaradılması,d
391,Sərgilərin təşkilində yerinə yetirilən məsələlərə aid deyildir:,"Maketlərin, nümunələrin yerləşdirilməsi",Maliyyə imkanlarının təhlili,Press – relizlərin hazırlanması,Reklam lahiyələrinin işlənib hazırlanması,Sərgidə çalışan heyətin öyrədilməsi,b
392,Bu sərgilərin gəlirlərini formalaşdıran istiqamətlərə aid deyildir.,Yerlərin icarəyə verilməsindən əldə edilən gəlirlər,Sərgiyə gələnlərin giriş haqqı üzrə ödənişlər,İştirakçilar tərəfindən edilən ödənişlər,"Vasitəçilik xidməti, məsləhətlər verilməsi üzrə ödənişlər",Məhsul satışından əldə edilən gəlirlər,e
393,Bu sərgilərin gəlirlərini formalaşdıran istiqamətlərə aid deyildir.,Vasitəçilik xidməti göstərilməsindən əldə edilən gəlirlər,Bədii-təsvir işlərinin aparılmasına görə ödənişlər,Reklam işinin yerinə yetirilməsindən əldə edilən gəlirlər,Məsləhətlər verilməsinə görə ödənişlər,Sərgiyə çıxarılan məhsulların satış qiymətinə edilən ticarət əlavələri.,e
394,Sərgilər bu məsələdə mühüm rol oynamır:,Əmtəə bazarlarının formalaşdırılması.,Məhsul satışının stimullaşdırılması,Məhsullara real tələb və təklifin müəyyənləşdirilməsi,Təsərrüfat əlaqələrinin yaxşılaşdırılması,Potensial alıcıların yeni məhsulla tanış edilməsi,b
395,"İctimai həyatdakı peşəkar tələblərdən biri də iclaslarda, konfranslarda, rəsmi ziyafətlərdə çıxış etmək bacarığıdır. Çıxış üçün hazırlığı əksər vaxtlarda hansı şöbəyə verilir?",Marketinq şöbəsinə,Maliyyə şöbəsinə,Mühasibat şöbəsinə,PR şöbəsinə,Kadrlar şöbəsinə,d
396,Sərgilərdə ekspozisiyalar nə vaxt uğurlu alına bilər?,Yazılı mətn materiallarında səmərəli şəkildə istidafə edildikdə,Diaqramlardan səmərəli şəkildə istifadə edildikdə,İllüstrasiyalardan səmərəli şəkildə istifadə edildikdə,Bütün cavablar doğrudur,Fotoşəkillərdən səmərəli şəkildə istifadə edildikdə,d
397,Vətəndaşların müraciətləri haqqında AR Qanunu neçənci ildə qıbul edilibdir?,2015,2012,2010,2005,2007,a
398,Vətəndaşların müraciətləri haqqında AR Qanunu ...?,Azərbaycan Respublikası hər kəsin müraciət etmək hüququnun həyata keçirilməsi ilə bağlı münasibətləri tənzimləmir,Müraciət etmək hüququnun həyata keçirilməsi ilə bağlı münasibətləri tənzimləyir,Azərbaycan Respublikası vətəndaşlarının müraciət etmək hüququnun həyata keçirilməsi ilə bağlı münasibətləri tənzimləyir,Azərbaycan Respublikası vətəndaşlarının müraciət etmək hüququnun həyata keçirilməsi ilə bağlı münasibətləri tənzimləmir,Azərbaycan Respublikasında hər kəsin müraciət etmək hüququnun həyata keçirilməsi ilə bağlı münasibətləri tənzimləyir,c
399,Vətəndaşların müraciətləri haqqında AR Qanunu ...?,Bələdiyyələrin müraciətlərə baxması qaydasını müəyyən edir,Bəzi dövlət orqanlarının müraciətlərə baxması qaydasını müəyyən edir,Bəzi vəzifəli şəxslərin müraciətlərə baxması qaydasını müəyyən edir,Dövlət orqanlarının müraciətlərə baxması qaydasını müəyyən edir,Vəzifəli şəxslərin müraciətlərə baxması qaydasını müəyyən edir,d
400,Daxili PR-in uğurlu olması üçün nə tələb olunur?,Rəhbərliyi işçilərdən ayırmaq,Media ilə əlaqələri kəsmək,İşçiləri layihələrdən uzaqlaşdırmaq,Rəqiblərin strategiyalarını kopyalamaq,Şirkətdaxili əməkdaşlığı gücləndirmək,e
401,İşçilərin şirkətlə bağlı narazılıqları necə həll edilir?,Anonim anketlərin nəticələrini təhlil etməklə,İşçilərə cəza tətbiq etməklə,Narazılıqları gizlətməklə,Heç biri,Media vasitəsilə şikayət yaymaqla,a
402,PR-in məqsədi işçilərlə əlaqədə hansı üstünlükdür?,İşçiləri tənqid etmək,Yalnız müştəri əlaqələrini artırmaq,Rəhbərliklə əlaqəni məhdudlaşdırmaq,İşçiləri daha çox işə cəlb etmək,Müsbət iş mühitini qorumaq,e
403,PR vasitəsilə işçilər haqqında məlumat necə toplanır?,Sosial şəbəkələrdə müşahidə apararaq,Heç bir məlumat toplanmır,Gizli müşahidələr yolu ilə,Yalnız rəhbərliyə verilən hesabatlar yolu ilə,Anonim anketlər vasitəsilə,e
404,Korporativ PR hansı fəaliyyətə daxildir?,Şirkət strategiyalarını gizlətməyə,İşçilərin motivasiyasını azaltmağa,Yalnız məhsul reklamına,Əməkdaşların məmnunluğuna fokuslanmağa,Fərdi müştəri analitikası aparmağa,d
405,Kollektivdə PR-in rolu hansı tədbirlər vasitəsilə artırılır?,Rəhbərliyi izolyasiya etməklə,Şirkətdaxili tədbirləri məhdudlaşdırmaqla,Təşkilatda rəqabəti artırmaqla,Qeyri-rəsmi naharların təşkili ilə,İşçiləri mətbuatdan uzaqlaşdırmaqla,d
