question_id,question_text,option_a,option_b,option_c,option_d,option_e,correct_answer_id
240,Dizaynın estetikləşdirmə funksiyasının əsas məqsədi hansıdır?,Reklamın qiymətini artırmaq,Malları yalnız dekorativ məqsədlə dəyişdirmək,Məhsulun texniki xüsusiyyətlərini gizlətmək,Yalnız rəqiblərin məhsullarını tənqid etmək,Məhsulu alıcı üçün cəlbedici etmək və satışını stimullaşdırmaq,e
241,"Hər hansı bir şirkətin məhsullarının satışında geniş yayılmış, kütləvi və ənənəvi olaraq qəzet və jurnallarda aparılan reklam forması hansıdır?",Mətbuatda reklam,Radio verilişləri,Televiziya reklamı,Sosial media reklamı,Birbaşa satış,a
242,İnternetdə əsas reklam daşıyıcıları hansılardır?,"Radioreklam süjetləri, Hava şarları","Televiziya telerolikləri, elektron poçt","Hava şarları, Standart küçə lövhəsi","Banner, veb­sayt, elektron poçt","Standart küçə lövhəsi, veb­sayt",d
243,Siti­format konstruksiyası hansı xüsusiyyətə malikdir?,"Binanın bütün divarında yerləşir, iri həcmlidir",Supersayt reklamı deyil. 1.5x1.8 m ölçülüdür,Radioreklamın geniş yayılmış formasıdır,"1.2x1.8 m ölçülü, əsasən yeraltı keçid və ictimai nəqliyyat üçün nəzərdə tutulur",Televiziya reklamının bir növüdür,d
244,Brandmauer hansı xarici reklam növüdür?,Standart küçə lövhəsi,Supersayt reklamı,Radioda istifadə olunan süjet­audiorolik,Həcmi 1.2x1.8 m olan dayanacaq konstruksiyası,Binanın pəncərəsi olmayan bütöv divarında yerləşdirilən iri reklam konstruksiyası,e
245,Xarici reklam üçün əsas tələblər hansıdır? Biri yanlış göstərilmişdir.,"yığcamlıq, aydınlıq",hərəkət zamanı asan oxunaqlıq,özünə diqqəti cəlb etmək,"gözə tez­tez dəymək, aydınlıq",geniş və mürəkkəb,e
246,Televiziyada təsviri rolik hansı tip reklamdır?,Sponsorluq proqramı,İnformasiya məzmunlu,Paradoksal qarşılaşdırmalar,Xoş əhval yaradan,Telemaqazin,b
